{
  "id": "injective-labs-options-market-94622345",
  "title": "Injective Labs Options Market",
  "type": "security-review",
  "publicationDate": "4",
  "url": "https://injective.com/",
  "categories": {
    "publicationType": "security-review",
    "domain": []
  },
  "metadata": {
    "product": "Injective Labs Options Market"
  }
}