{
  "id": "scroll-zkevm-wave-1-7817fcd3",
  "title": "Scroll ZkEVM Wave 1",
  "type": "security-review",
  "publicationDate": "23",
  "url": "https://scroll.io/",
  "categories": {
    "publicationType": "security-review",
    "domain": [
      "cryptography"
    ]
  },
  "tags": {
    "platforms": [
      "ethereum"
    ]
  },
  "metadata": {
    "product": "Scroll ZkEVM Wave 1",
    "client": "Scroll"
  }
}