{
  "id": "smart-contracts-the-beta-ec88efd0",
  "title": "Smart Contracts: The Beta",
  "type": "presentation",
  "publicationDate": "2023",
  "authors": [
    "Nat Chin"
  ],
  "url": "presentations/Smart%20Contracts:%20The%20Beta/DSS%20101.pdf",
  "categories": {
    "publicationType": "presentation",
    "domain": [
      "blockchain"
    ],
    "subdomain": [
      "smart-contracts"
    ]
  },
  "tags": {
    "topics": [
      "smart-contracts"
    ]
  }
}