{
  "id": "osquery-extension-skunkworks-fec0606c",
  "title": "osquery Extension Skunkworks",
  "type": "presentation",
  "publicationDate": "2018",
  "authors": [
    "Mike Myers"
  ],
  "url": "presentations/osquery%20Extension%20Skunkworks",
  "categories": {
    "publicationType": "presentation",
    "domain": []
  }
}