{
  "id": "hashing-it-out-53-2d83cd52",
  "title": "Hashing it Out 53",
  "type": "podcast",
  "publicationDate": "2019",
  "authors": [
    "Dan Guido"
  ],
  "url": "https://thebitcoinpodcast.com/hashing-it-out-53/",
  "categories": {
    "publicationType": "podcast",
    "domain": [
      "blockchain"
    ],
    "subdomain": [
      "smart-contracts"
    ]
  },
  "tags": {
    "topics": [
      "smart-contracts"
    ]
  }
}