{
  "id": "toward-comprehensive-risk-assessments-and-assurance-of-ai-ba-48d9a737",
  "title": "Toward Comprehensive Risk Assessments and Assurance of AI-Based Systems",
  "type": "white-paper",
  "publicationDate": "2023",
  "authors": [
    "Heidy Khlaaf"
  ],
  "url": "papers/trailofbits-20230307-ai-risk-assessments-whitepaper.pdf",
  "categories": {
    "publicationType": "white-paper",
    "domain": [
      "ai-ml"
    ]
  }
}