{
  "id": "reddit-4451c215",
  "title": "Reddit",
  "type": "security-review",
  "publicationDate": "1",
  "url": "https://www.reddit.com/community-points/",
  "categories": {
    "publicationType": "security-review",
    "domain": [
      "blockchain"
    ]
  },
  "metadata": {
    "product": "Reddit",
    "client": "Ethereum/EVM"
  }
}